{
  "name": "pyrun-native-probe",
  "version": "0.1.0",
  "python_tag": "cp313-cp313",
  "android_api_min": 25,
  "abis": ["arm64_v8a", "x86_64"],
  "license": "MIT",
  "source_url": "https://github.com/dactechstudio/pyrun-wheels",
  "build": {
    "cibuildwheel": "4.3.1",
    "ndk": "30.0.16248370",
    "setuptools": "80.9.0",
    "wheel": "0.45.1"
  },
  "patches": [],
  "runtime_dependencies": [],
  "sbom": "sbom/pyrun-native-probe.cdx.json"
}
